{
  "schema_version": "v1",
  "benchmark": "terminal-bench-2-1",
  "preset": "three-tasks-3-trials",
  "leaderboard_eligible": false,
  "job": {
    "datasets": [
      {
        "repo": "https://github.com/harbor-framework/terminal-bench-2-1.git@d49e28f1e4ddd13d289e85a5f312a66750951932",
        "path": "tasks",
        "task_names": [
          "code-from-image",
          "log-summary-date-ranges",
          "openssl-selfsigned-cert"
        ]
      }
    ],
    "n_attempts": 3,
    "n_concurrent_trials": 3,
    "environment": {
      "type": "hf-sandbox",
      "kwargs": {
        "flavor": "cpu-upgrade",
        "job_timeout": "none"
      }
    },
    "agent_timeout_multiplier": 4,
    "agent_setup_timeout_multiplier": 2
  }
}
