{
  "schema_version": "v1",
  "benchmark": "terminal-bench-3-0",
  "preset": "all-tasks-1-trial",
  "leaderboard_eligible": false,
  "job": {
    "datasets": [
      {
        "repo": "https://github.com/harbor-framework/terminal-bench.git@2b0442c3c583b710ca8da14c8e601b99f2f1f244",
        "path": "tasks"
      }
    ],
    "n_attempts": 1,
    "n_concurrent_trials": 8,
    "environment": {
      "type": "hf-sandbox",
      "kwargs": {
        "flavor": "cpu-upgrade",
        "job_timeout": "none"
      }
    }
  }
}
